[{"cost":1,"effects":[{"op":"place_stone","stone":"basic"}],"id":"card_basic_stone","name_ja":"打石","placement_tags":["frontline","terminal"],"rarity":"starter","type":"stone"},{"cost":1,"effects":[{"op":"place_stone","stone":"basic"},{"cards":1,"op":"draw_if_real_liberties_at_least","value":3}],"id":"card_extend","name_ja":"ノビ","placement_tags":["frontline"],"rarity":"starter","type":"stone"},{"cost":1,"effects":[{"op":"place_stone","stone":"basic"},{"op":"gain_qi_if_enemy_atari","value":1}],"id":"card_contact","name_ja":"ツケ","placement_tags":["contact","terminal"],"rarity":"starter","type":"stone"},{"cost":1,"effects":[{"cards":1,"op":"draw_if_target_atari"},{"duration":{"kind":"enemy_turn_end","timing":"first_enemy_turn_end_at_or_after_grant"},"op":"temporary_liberty","stacking":"additive_per_effect_instance","value":1}],"id":"card_reinforce","name_ja":"補強","rarity":"starter","target":"friendly_group","type":"technique"},{"cost":2,"effects":[{"facility":"development","op":"build_facility"}],"id":"card_development","name_ja":"開拓","rarity":"starter","target":"black_territory_empty","type":"territory"},{"cost":0,"effects":[{"op":"place_stone","stone":"lure"},{"cards":1,"op":"reserve_draw"}],"id":"card_lure_stone","name_ja":"囮石","on_captured":[{"cards":2,"op":"reserve_draw"}],"placement_tags":["contact"],"rarity":"starter","type":"stone"},{"cost":1,"effects":[{"op":"place_stone","stone":"basic"}],"id":"card_one_space_jump","name_ja":"一間トビ","placement_tags":["jump"],"rarity":"common","type":"stone"},{"cost":2,"effects":[{"op":"place_stone","stone":"basic"},{"op":"gain_qi_if_territory_created","value":1}],"id":"card_edge_crawl","name_ja":"辺這い","placement_tags":["edge"],"rarity":"common","type":"stone"},{"cost":2,"effects":[{"op":"place_stone","stone":"infiltrator"}],"id":"card_infiltrate","name_ja":"忍び","on_survive_to_next_turn":[{"cards":1,"op":"draw"}],"placement_tags":["invasion"],"rarity":"uncommon","type":"stone"},{"cost":1,"effects":[{"op":"place_stone","stone":"blood"}],"id":"card_blood_stone","name_ja":"血石","on_captured":[{"cards":1,"op":"reserve_draw"},{"op":"gain_soul","value":1}],"placement_tags":["frontline"],"rarity":"common","type":"stone"},{"cost":1,"effects":[{"op":"place_stone","stone":"seed"},{"op":"schedule_growth","turns":1}],"id":"card_seed_stone","name_ja":"種石","placement_tags":["frontline"],"rarity":"common","type":"stone"},{"cost":2,"effects":[{"facility":"furnace","op":"build_facility"}],"id":"card_furnace","name_ja":"炉","rarity":"uncommon","target":"black_territory_empty","type":"territory"},{"cost":2,"effects":[{"facility":"market","op":"build_facility"}],"id":"card_market","name_ja":"市場","rarity":"rare","target":"black_territory_empty","type":"territory"},{"cost":2,"effects":[{"draw":2,"gain_qi":1,"op":"arm_next_capture"}],"id":"card_capture_chain","name_ja":"連続捕獲","rarity":"rare","type":"catalyst"},{"cost":3,"effects":[{"draw":1,"gain_qi":1,"op":"schedule_framework_conversion","turns":2}],"id":"card_large_framework","name_ja":"大模様","rarity":"rare","target":"center_region","type":"catalyst"}]
